{
  "schema": "yaaw.workload/v1",
  "id": "SYNTHETIC-LOCAL-COMPARISON",
  "provenance": {
    "kind": "SYNTHETIC",
    "repository": "local-fixture",
    "ref": "fixture",
    "commit": "synthetic-fixture-v1"
  },
  "task": "Exercise baseline-vs-governed comparison, provenance classification and failure-preserving reporting without making network or model calls.",
  "allowed_scope": ["evals/**", "tests/harness/**"],
  "verification": ["python scripts/run_workload_compare.py --workload evals/workloads/synthetic-local.json --simulate"],
  "baseline_manifest": "evals/workloads/synthetic-baseline.json",
  "governed_manifest": "evals/workloads/synthetic-governed.json",
  "baseline_manifest_id": "SYNTHETIC-BASELINE",
  "governed_manifest_id": "SYNTHETIC-GOVERNED",
  "baseline_manifest_fingerprint": "5a129198b9ba1de0ad9c5dbf906cc16d7d1b3338638409e84d7c0376fbe07299",
  "governed_manifest_fingerprint": "226242669c2a15e4d8afa6b27d05e6e90804b9d9680dd161397ebd64e656676a"
}
